{
  "protocol_version": "4.0.0",
  "compiled_at": "2026-08-12T10:19:26+08:00",
  "compiled_by": "protocol_compiler",
  "source_sha256": "5687e936efa4feff3f072275506f20d2363bfc2033f59debc7fc8aeeaaf4fff7",
  "actions": [
    {
      "intent_id": "ticket.add_detail",
      "display_name": "补充工单信息",
      "explicit_keywords": [
        "#补充"
      ],
      "semantic_enabled": true,
      "allowed_roles": [
        "ENGINEER",
        "MANAGER",
        "OTHER"
      ],
      "allowed_ticket_states": [
        "ACTIVE",
        "ACTIVE_OVERDUE"
      ],
      "required_fields": [
        "ticket_no"
      ],
      "optional_fields": [
        "content",
        "attachments"
      ],
      "target_ticket_policy": "MUST_EXIST",
      "risk_level": "LOW",
      "confirmation_policy": {
        "EXPLICIT_KEYWORD": "NOT_REQUIRED",
        "SEMANTIC_MODEL": "BY_CONFIDENCE"
      },
      "positive_examples": [
        "麻烦补充一下工单信息，问题描述：空调漏水更严重了",
        "#补充 工单编号：W001 问题描述：空调漏水更严重了",
        "业务表达1：麻烦补充一下工单信息，问题描述：空调漏水更严重了",
        "业务表达2：#补充 工单编号：W001 问题描述：空调漏水更严重了",
        "业务表达3：麻烦补充一下工单信息，问题描述：空调漏水更严重了",
        "业务表达4：#补充 工单编号：W001 问题描述：空调漏水更严重了",
        "业务表达5：麻烦补充一下工单信息，问题描述：空调漏水更严重了",
        "业务表达6：#补充 工单编号：W001 问题描述：空调漏水更严重了",
        "业务表达7：麻烦补充一下工单信息，问题描述：空调漏水更严重了",
        "业务表达8：#补充 工单编号：W001 问题描述：空调漏水更严重了"
      ],
      "negative_examples": [
        "补充说明一下",
        "我刚才说的是补充",
        "补充点别的",
        "边界反例1：补充说明一下",
        "边界反例2：我刚才说的是补充",
        "边界反例3：补充点别的",
        "边界反例4：补充说明一下",
        "边界反例5：我刚才说的是补充",
        "边界反例6：补充点别的",
        "边界反例7：补充说明一下"
      ],
      "confirmation_template": "",
      "executor": "add_ticket_detail",
      "field_definitions": {
        "ticket_no": {
          "type": "string",
          "required": true
        }
      }
    },
    {
      "intent_id": "ticket.cancel",
      "display_name": "取消工单",
      "explicit_keywords": [
        "#取消工单"
      ],
      "semantic_enabled": true,
      "allowed_roles": [
        "MANAGER"
      ],
      "allowed_ticket_states": [
        "ACTIVE",
        "ACTIVE_OVERDUE"
      ],
      "required_fields": [
        "ticket_no",
        "cancel_reason"
      ],
      "optional_fields": [],
      "target_ticket_policy": "MUST_EXIST",
      "risk_level": "HIGH",
      "confirmation_policy": {
        "EXPLICIT_KEYWORD": "NOT_REQUIRED",
        "SEMANTIC_MODEL": "ALWAYS"
      },
      "positive_examples": [
        "帮我把这个误报工单取消掉",
        "#取消工单 工单编号：W001 取消原因：误报",
        "业务表达1：帮我把这个误报工单取消掉",
        "业务表达2：#取消工单 工单编号：W001 取消原因：误报",
        "业务表达3：帮我把这个误报工单取消掉",
        "业务表达4：#取消工单 工单编号：W001 取消原因：误报",
        "业务表达5：帮我把这个误报工单取消掉",
        "业务表达6：#取消工单 工单编号：W001 取消原因：误报",
        "业务表达7：帮我把这个误报工单取消掉",
        "业务表达8：#取消工单 工单编号：W001 取消原因：误报"
      ],
      "negative_examples": [
        "这个工单可以取消吗",
        "要不要取消工单",
        "我可能想取消这个工单",
        "边界反例1：这个工单可以取消吗",
        "边界反例2：要不要取消工单",
        "边界反例3：我可能想取消这个工单",
        "边界反例4：这个工单可以取消吗",
        "边界反例5：要不要取消工单",
        "边界反例6：我可能想取消这个工单",
        "边界反例7：这个工单可以取消吗"
      ],
      "confirmation_template": "",
      "executor": "cancel_ticket",
      "field_definitions": {
        "ticket_no": {
          "type": "string",
          "required": true
        },
        "cancel_reason": {
          "type": "text",
          "required": true
        }
      }
    },
    {
      "intent_id": "ticket.complete",
      "display_name": "",
      "explicit_keywords": [
        "#完毕"
      ],
      "semantic_enabled": true,
      "allowed_roles": [
        "ENGINEER",
        "MANAGER"
      ],
      "allowed_ticket_states": [
        "ACTIVE",
        "ACTIVE_OVERDUE"
      ],
      "required_fields": [],
      "optional_fields": [],
      "target_ticket_policy": "MUST_EXIST",
      "risk_level": "HIGH",
      "confirmation_policy": {
        "EXPLICIT_KEYWORD": "NOT_REQUIRED",
        "SEMANTIC_MODEL": "NOT_REQUIRED"
      },
      "positive_examples": [
        "维修已经完成了，今天测试一切正常",
        "业务表达1：维修已经完成了，今天测试一切正常",
        "业务表达2：维修已经完成了，今天测试一切正常",
        "业务表达3：维修已经完成了，今天测试一切正常",
        "业务表达4：维修已经完成了，今天测试一切正常",
        "业务表达5：维修已经完成了，今天测试一切正常",
        "业务表达6：维修已经完成了，今天测试一切正常",
        "业务表达7：维修已经完成了，今天测试一切正常",
        "业务表达8：维修已经完成了，今天测试一切正常",
        "业务表达9：维修已经完成了，今天测试一切正常"
      ],
      "negative_examples": [
        "完成了吗",
        "是不是可以完毕了",
        "还不确定是否完成",
        "边界反例1：完成了吗",
        "边界反例2：是不是可以完毕了",
        "边界反例3：还不确定是否完成",
        "边界反例4：完成了吗",
        "边界反例5：是不是可以完毕了",
        "边界反例6：还不确定是否完成",
        "边界反例7：完成了吗"
      ],
      "confirmation_template": "",
      "executor": "complete_ticket",
      "field_definitions": {}
    },
    {
      "intent_id": "ticket.create",
      "display_name": "",
      "explicit_keywords": [
        "#报修"
      ],
      "semantic_enabled": true,
      "allowed_roles": [
        "MANAGER",
        "OTHER"
      ],
      "allowed_ticket_states": [],
      "required_fields": [
        "subject",
        "location",
        "problem_description"
      ],
      "optional_fields": [],
      "target_ticket_policy": "MUST_NOT_EXIST",
      "risk_level": "NORMAL",
      "confirmation_policy": {
        "EXPLICIT_KEYWORD": "NOT_REQUIRED",
        "SEMANTIC_MODEL": "BY_CONFIDENCE"
      },
      "positive_examples": [
        "博物馆奇妙夜第一个房间的门下沉明显，开门时发生剐蹭，希望3天内能修好",
        "#报修\n主题：博物馆奇妙夜\n位置：第一个房间的门\n问题描述：门下沉明显，开门时发生剐蹭\n时效：3天",
        "业务表达1：博物馆奇妙夜第一个房间的门下沉明显，开门时发生剐蹭，希望3天内能修好",
        "业务表达2：#报修\n主题：博物馆奇妙夜\n位置：第一个房间的门\n问题描述：门下沉明显，开门时发生剐蹭\n时效：3天",
        "业务表达3：博物馆奇妙夜第一个房间的门下沉明显，开门时发生剐蹭，希望3天内能修好",
        "业务表达4：#报修\n主题：博物馆奇妙夜\n位置：第一个房间的门\n问题描述：门下沉明显，开门时发生剐蹭\n时效：3天",
        "业务表达5：博物馆奇妙夜第一个房间的门下沉明显，开门时发生剐蹭，希望3天内能修好",
        "业务表达6：#报修\n主题：博物馆奇妙夜\n位置：第一个房间的门\n问题描述：门下沉明显，开门时发生剐蹭\n时效：3天",
        "业务表达7：博物馆奇妙夜第一个房间的门下沉明显，开门时发生剐蹭，希望3天内能修好",
        "业务表达8：#报修\n主题：博物馆奇妙夜\n位置：第一个房间的门\n问题描述：门下沉明显，开门时发生剐蹭\n时效：3天"
      ],
      "negative_examples": [
        "门坏了怎么办",
        "能不能报个修",
        "今天天气不错",
        "边界反例1：门坏了怎么办",
        "边界反例2：能不能报个修",
        "边界反例3：今天天气不错",
        "边界反例4：门坏了怎么办",
        "边界反例5：能不能报个修",
        "边界反例6：今天天气不错",
        "边界反例7：门坏了怎么办"
      ],
      "confirmation_template": "",
      "executor": "create_ticket",
      "field_definitions": {
        "subject": {
          "type": "text",
          "required": true
        },
        "location": {
          "type": "text",
          "required": true
        },
        "problem_description": {
          "type": "text",
          "required": true
        },
        "device": {
          "type": "text",
          "required": false
        },
        "sla": {
          "type": "enum",
          "required": false,
          "allowed": [
            "1天",
            "3天",
            "7天"
          ]
        }
      }
    },
    {
      "intent_id": "ticket.diagnosis.submit",
      "display_name": "",
      "explicit_keywords": [
        "#故障判断"
      ],
      "semantic_enabled": true,
      "allowed_roles": [
        "ENGINEER"
      ],
      "allowed_ticket_states": [
        "ACTIVE",
        "ACTIVE_OVERDUE"
      ],
      "required_fields": [],
      "optional_fields": [],
      "target_ticket_policy": "MUST_EXIST",
      "risk_level": "NORMAL",
      "confirmation_policy": {
        "EXPLICIT_KEYWORD": "NOT_REQUIRED",
        "SEMANTIC_MODEL": "BY_CONFIDENCE"
      },
      "positive_examples": [
        "我检查了一下，判断是门体明显下沉，另外上侧合页也存在松动",
        "业务表达1：我检查了一下，判断是门体明显下沉，另外上侧合页也存在松动",
        "业务表达2：我检查了一下，判断是门体明显下沉，另外上侧合页也存在松动",
        "业务表达3：我检查了一下，判断是门体明显下沉，另外上侧合页也存在松动",
        "业务表达4：我检查了一下，判断是门体明显下沉，另外上侧合页也存在松动",
        "业务表达5：我检查了一下，判断是门体明显下沉，另外上侧合页也存在松动",
        "业务表达6：我检查了一下，判断是门体明显下沉，另外上侧合页也存在松动",
        "业务表达7：我检查了一下，判断是门体明显下沉，另外上侧合页也存在松动",
        "业务表达8：我检查了一下，判断是门体明显下沉，另外上侧合页也存在松动",
        "业务表达9：我检查了一下，判断是门体明显下沉，另外上侧合页也存在松动"
      ],
      "negative_examples": [
        "可能是门框的问题吧",
        "不太确定什么故障",
        "你们觉得呢",
        "边界反例1：可能是门框的问题吧",
        "边界反例2：不太确定什么故障",
        "边界反例3：你们觉得呢",
        "边界反例4：可能是门框的问题吧",
        "边界反例5：不太确定什么故障",
        "边界反例6：你们觉得呢",
        "边界反例7：可能是门框的问题吧"
      ],
      "confirmation_template": "",
      "executor": "submit_diagnosis",
      "field_definitions": {}
    },
    {
      "intent_id": "ticket.query",
      "display_name": "查询工单",
      "explicit_keywords": [
        "#查询工单"
      ],
      "semantic_enabled": true,
      "allowed_roles": [
        "ENGINEER",
        "MANAGER",
        "OTHER"
      ],
      "allowed_ticket_states": [
        "ACTIVE",
        "ACTIVE_OVERDUE"
      ],
      "required_fields": [],
      "optional_fields": [
        "ticket_no"
      ],
      "target_ticket_policy": "ANY",
      "risk_level": "LOW",
      "confirmation_policy": {
        "EXPLICIT_KEYWORD": "NOT_REQUIRED",
        "SEMANTIC_MODEL": "BY_CONFIDENCE"
      },
      "positive_examples": [
        "#查询工单",
        "#查询工单 W001",
        "业务表达1：#查询工单",
        "业务表达2：#查询工单 W001",
        "业务表达3：#查询工单",
        "业务表达4：#查询工单 W001",
        "业务表达5：#查询工单",
        "业务表达6：#查询工单 W001",
        "业务表达7：#查询工单",
        "业务表达8：#查询工单 W001"
      ],
      "negative_examples": [
        "帮我查一下工单",
        "现在有哪些工单在处理",
        "边界反例1：帮我查一下工单",
        "边界反例2：现在有哪些工单在处理",
        "边界反例3：帮我查一下工单",
        "边界反例4：现在有哪些工单在处理",
        "边界反例5：帮我查一下工单",
        "边界反例6：现在有哪些工单在处理",
        "边界反例7：帮我查一下工单",
        "边界反例8：现在有哪些工单在处理"
      ],
      "confirmation_template": "",
      "executor": "query_ticket",
      "field_definitions": {}
    },
    {
      "intent_id": "ticket.reopen",
      "display_name": "重开工单",
      "explicit_keywords": [
        "#重开工单"
      ],
      "semantic_enabled": true,
      "allowed_roles": [
        "ENGINEER",
        "MANAGER"
      ],
      "allowed_ticket_states": [
        "COMPLETED",
        "CANCELLED"
      ],
      "required_fields": [
        "ticket_no",
        "reopen_reason"
      ],
      "optional_fields": [],
      "target_ticket_policy": "MUST_EXIST",